{
  "$schema": "design-system.schema.json",
  "schemaVersion": "1.0.0",
  "name": "Logpresso Design System",
  "version": "0.2.0-preview",
  "purpose": "Public AI-consumable design system entrypoint for reference design, mockup generation, and screen specification.",
  "runtime": {
    "defaultLocale": "ko",
    "supportedLocales": [
      "ko",
      "en"
    ],
    "defaultFramework": "HTML",
    "supportedFrameworks": [
      "HTML",
      "React",
      "Vue",
      "Angular"
    ],
    "defaultTheme": "light",
    "versioningPolicy": "Use semantic versioning: bump major for incompatible public contract changes, minor for new agent/component/runtime capabilities, and patch for compatible fixes.",
    "localePolicy": "Source Markdown may provide paired ko/en ds-locale blocks for human-facing descriptions while component truth, token names, state names, file paths, selectors, and code identifiers stay exact."
  },
  "entrypoints": {
    "webCatalog": "index.html",
    "manifest": "design-system.manifest.json",
    "manifestSchema": "design-system.schema.json",
    "aiAgentGuide": "docs/AI-AGENT-GUIDE.md",
    "componentIndex": "docs/components/components.md",
    "patternIndex": "docs/patterns/patterns.md",
    "foundationDirectory": "docs/foundation",
    "rulesDirectory": "docs/rules",
    "tokenGuide": "docs/tokens/tokens.md",
    "tokenRegistry": "docs/tokens/design-tokens.json",
    "accessibilityGuide": "docs/accessibility/accessibility-matrix.md",
    "accessibilityMatrix": "docs/accessibility/component-accessibility-matrix.json",
    "accessibilityCoverageGuide": "docs/accessibility/component-accessibility-coverage.md",
    "accessibilityCoverage": "docs/accessibility/component-accessibility-coverage.json",
    "referenceScreenExamples": "docs/patterns/reference-screen-examples.json",
    "referenceScreenExamplesGuide": "docs/patterns/reference-screen-examples.md",
    "agentStarterPack": "agent-starters.json",
    "outputTemplate": "docs/ai/reference-design-output-template.md",
    "readinessReport": "docs/ai/public-readiness-report.md",
    "publicationPolicy": "docs/ai/publication-policy.md"
  },
  "counts": {
    "components": 65,
    "foundations": 12,
    "patterns": 15,
    "governanceRules": 3
  },
  "readingOrder": [
    "design-system.manifest.json",
    "docs/AI-AGENT-GUIDE.md",
    "docs/components/components.md",
    "docs/patterns/patterns.md",
    "docs/patterns/reference-screen-examples.json",
    "docs/tokens/design-tokens.json",
    "docs/accessibility/component-accessibility-matrix.json",
    "docs/accessibility/component-accessibility-coverage.json",
    "docs/ai/publication-policy.md",
    "target pattern document",
    "parent composition component documents",
    "child family component documents",
    "required foundation documents",
    "product-specific screen spec"
  ],
  "components": [
    {
      "name": "GNB",
      "category": "Navigation / Shell",
      "sourceCategory": "Navigation / Shell",
      "status": "reusable composition pattern",
      "path": "docs/components/GNB.md",
      "note": "top-level shared shell, child placementì shell rule ìì ",
      "locales": {
        "ko": {
          "category": "Navigation / Shell",
          "sourceCategory": "Navigation / Shell",
          "status": "reusable composition pattern",
          "note": "top-level shared shell, child placementì shell rule ìì "
        },
        "en": {
          "category": "Navigation / Shell",
          "sourceCategory": "Navigation / Shell",
          "status": "reusable composition pattern",
          "note": "Owns top-level shared shell rules, child placement, and shell rules."
        }
      },
      "compositionHints": [
        "SNB",
        "Action Bar",
        "Page Layout"
      ],
      "foundationHints": [
        "docs/foundation/color.md",
        "docs/foundation/typography.md"
      ],
      "relatedPatterns": [
        "Data Table Workflow",
        "Workflow / Guided Setup",
        "UX Bulk Action",
        "UX Hierarchical Navigation"
      ]
    },
    {
      "name": "SNB",
      "category": "Navigation / Shell",
      "sourceCategory": "Navigation / Shell",
      "status": "reusable composition pattern",
      "path": "docs/components/SNB.md",
      "note": "left-side navigation rail, appNav areaì navList êµ¬ì¡° ìì ",
      "locales": {
        "ko": {
          "category": "Navigation / Shell",
          "sourceCategory": "Navigation / Shell",
          "status": "reusable composition pattern",
          "note": "left-side navigation rail, appNav areaì navList êµ¬ì¡° ìì "
        },
        "en": {
          "category": "Navigation / Shell",
          "sourceCategory": "Navigation / Shell",
          "status": "reusable composition pattern",
          "note": "Owns the left-side navigation rail, appNav area, and navList structure."
        }
      },
      "compositionHints": [
        "GNB",
        "Action Bar",
        "Page Layout"
      ],
      "foundationHints": [
        "docs/foundation/color.md",
        "docs/foundation/typography.md"
      ],
      "relatedPatterns": [
        "Data Table Workflow",
        "Workflow / Guided Setup",
        "UX Bulk Action",
        "UX Hierarchical Navigation"
      ]
    },
    {
      "name": "Page Layout",
      "category": "Navigation / Shell",
      "sourceCategory": "Navigation / Shell",
      "status": "reusable composition pattern",
      "path": "docs/components/Page Layout.md",
      "note": "GNB/SNB/Main/ActionBar/Content regionì ë°°ì¹íë page-level composition",
      "locales": {
        "ko": {
          "category": "Navigation / Shell",
          "sourceCategory": "Navigation / Shell",
          "status": "reusable composition pattern",
          "note": "GNB/SNB/Main/ActionBar/Content regionì ë°°ì¹íë page-level composition"
        },
        "en": {
          "category": "Navigation / Shell",
          "sourceCategory": "Navigation / Shell",
          "status": "reusable composition pattern",
          "note": "Places GNB, SNB, main, ActionBar, and content regions."
        }
      },
      "compositionHints": [
        "GNB",
        "SNB",
        "Action Bar"
      ],
      "foundationHints": [
        "docs/foundation/color.md",
        "docs/foundation/typography.md",
        "docs/foundation/content.md"
      ],
      "relatedPatterns": [
        "Data Table Workflow",
        "Workflow / Guided Setup",
        "UX Bulk Action",
        "UX Hierarchical Navigation"
      ]
    },
    {
      "name": "Action Bar",
      "category": "Navigation / Shell",
      "sourceCategory": "Navigation / Shell",
      "status": "reusable composition pattern",
      "path": "docs/components/Action Bar.md",
      "note": "parent composition only, child truth ì¬ì ì ê¸ì§",
      "locales": {
        "ko": {
          "category": "Navigation / Shell",
          "sourceCategory": "Navigation / Shell",
          "status": "reusable composition pattern",
          "note": "parent composition only, child truth ì¬ì ì ê¸ì§"
        },
        "en": {
          "category": "Navigation / Shell",
          "sourceCategory": "Navigation / Shell",
          "status": "reusable composition pattern",
          "note": "Parent composition only; child truth must not be redefined."
        }
      },
      "compositionHints": [
        "GNB",
        "SNB",
        "Page Layout"
      ],
      "foundationHints": [
        "docs/foundation/color.md",
        "docs/foundation/typography.md"
      ],
      "relatedPatterns": [
        "Data Table Workflow",
        "Workflow / Guided Setup",
        "UX Bulk Action",
        "UX Hierarchical Navigation"
      ]
    },
    {
      "name": "SNBToggle",
      "category": "Navigation / Shell",
      "sourceCategory": "Navigation / Shell",
      "status": "local usage",
      "path": "docs/components/SNBToggle.md",
      "note": "GNB ì usage-level icon-only control",
      "locales": {
        "ko": {
          "category": "Navigation / Shell",
          "sourceCategory": "Navigation / Shell",
          "status": "local usage",
          "note": "GNB ì usage-level icon-only control"
        },
        "en": {
          "category": "Navigation / Shell",
          "sourceCategory": "Navigation / Shell",
          "status": "local usage",
          "note": "Usage-level icon-only control inside GNB."
        }
      },
      "compositionHints": [
        "GNB",
        "SNB",
        "Action Bar",
        "Page Layout"
      ],
      "foundationHints": [
        "docs/foundation/color.md",
        "docs/foundation/typography.md"
      ],
      "relatedPatterns": [
        "Data Table Workflow",
        "Workflow / Guided Setup",
        "UX Bulk Action",
        "UX Hierarchical Navigation"
      ]
    },
    {
      "name": "UserConsole",
      "category": "Navigation / Shell",
      "sourceCategory": "Navigation / Shell",
      "status": "local usage",
      "path": "docs/components/UserConsole.md",
      "note": "current scopeë entry triggerì GNB ë´ ë°°ì¹ë§ ìì , êµ¬í ì ê¹ì§ iconButton CSS fallback ì¬ì©",
      "locales": {
        "ko": {
          "category": "Navigation / Shell",
          "sourceCategory": "Navigation / Shell",
          "status": "local usage",
          "note": "current scopeë entry triggerì GNB ë´ ë°°ì¹ë§ ìì , êµ¬í ì ê¹ì§ iconButton CSS fallback ì¬ì©"
        },
        "en": {
          "category": "Navigation / Shell",
          "sourceCategory": "Navigation / Shell",
          "status": "local usage",
          "note": "Current scope owns only the entry trigger and GNB placement; use iconButton CSS fallback until implementation is confirmed."
        }
      },
      "compositionHints": [
        "GNB",
        "SNB",
        "Action Bar",
        "Page Layout"
      ],
      "foundationHints": [
        "docs/foundation/color.md",
        "docs/foundation/typography.md"
      ],